{
  "schema": "implement-rfc.milestone-plan.v1",
  "id": "attended-review-audio-questions",
  "scope": {
    "issues": [
      "ASK-0114",
      "ASK-0115"
    ]
  },
  "milestones": [
    {
      "id": "audio-feedback",
      "outcome": "One portable mixed review queue offers exact per-clip audio answers, sequential comparison and durable shared feedback through live and offline intake.",
      "work": [
        {
          "issue": "ASK-0114"
        },
        {
          "issue": "ASK-0115"
        }
      ],
      "depends_on": [],
      "exit_criteria": [
        "AC01\u2013AC08 are demonstrated through focused public CLI/HTTP and native-browser fixture evidence.",
        "Legacy fingerprints and version-1 imports remain supported; new formats preserve feedback without false acceptance.",
        "Canonical contract, example, acceptance records and source-only closeout agree; task commands and writers are quiescent."
      ],
      "boundary": "Source-only AgentSkills attended-review change; no consumer migration, deployment or Faraday session mutation."
    }
  ]
}
