{
  "schema": "implement-rfc.milestone-plan.v1",
  "id": "remote-station-skill",
  "scope": {
    "issues": ["ASK-0124", "ASK-0125", "ASK-0126", "ASK-0127"]
  },
  "milestones": [
    {
      "id": "agentskills-skill",
      "outcome": "A portable remote-station skill configured only by station.json owns every station behavior, ships a version-free launch_remote_station command, joins the rfc bundle, and leaves implement-rfc only temporary forwarders.",
      "work": [{"issue": "ASK-0124"}],
      "depends_on": [],
      "exit_criteria": [
        "AC01-AC05 and AC08 are demonstrated through public script and forwarder paths in disposable fixture consumers, including a consumer without implement-rfc and a real MASK bundle install.",
        "Existing station identity, lease, lifecycle, takeover and ASK-0123 turn-read behavior is preserved with its tests running from remote-station source; implement-rfc holds no station implementation besides the two forwarders.",
        "Skill and implement-rfc documentation, the bundle, closeout checklist and continuation agree; task commands and writers are quiescent."
      ],
      "boundary": "AgentSkills source only; no AITO or BetterPullReview edits, push, publication or credential change."
    },
    {
      "id": "aito-migration",
      "outcome": "AITO launches its stations through a forwarder to remote-station with station.json, and its private launcher, Codex helper and their tests are gone.",
      "work": [{"issue": "ASK-0125"}],
      "depends_on": ["agentskills-skill"],
      "exit_criteria": [
        "AC06 is observed natively on Windows: aito-main-win resumes with the same station_id, Codex thread and Claude session and prints the return-path warning.",
        "The owner's uncommitted AITO station edits are reconciled before the fork files are deleted."
      ],
      "boundary": "AITO repository under its own instructions and tracker; native resume may require the owner."
    },
    {
      "id": "bpr-migration",
      "outcome": "BetterPullReview's documented station commands behave as before through remote-station without private takeover defaults.",
      "work": [{"issue": "ASK-0126"}, {"issue": "ASK-0127"}],
      "depends_on": ["agentskills-skill"],
      "exit_criteria": [
        "AC07 is demonstrated through BetterPullReview's documented commands, including takeover with no options.",
        "RFC-ASK-0017 closeout reconciles AC01-AC08 against RFC_BASE_SHA with truthful pending native evidence."
      ],
      "boundary": "BetterPullReview repository under its own instructions and tracker, plus AgentSkills closeout records."
    }
  ]
}
